### ISSUE TITLE
Staging shelley: cardano-node stop syncing from byron-proxy after block 672078

### ISSUE THREAD

**Issue by jbgi** [input-output-hk/cardano-byron-proxy#88]
Whereas the proxy has much more blocks.
Cf. https://monitoring.staging-shelley.dev.iohkdev.io/grafana/d/Oe0reiHef/cardano-application-metrics-v2?orgId=1&from=1577823801222&to=1577893591400 for when the chains started diverging (p-* node are the byron-proxy and the other are running cardano-node).
On cardano-node side, last logs are:
```
[c-c-1:cardano.node.Mux:Debug:74] [2020-01-17 13:55:42.20 UTC] {"event":"Channel Send End on MiniProtocolNum 2","kind":"MuxTrace","bearer":"ConnectionId {localAddress = 172.31.9.105:45523, remoteAddress = 13.251.202.44:3001}"}
[c-c-1:cardano.node.Mux:Debug:74] [2020-01-17 13:55:42.20 UTC] {"event":"Channel Send Start on MiniProtocolNum 2 2","kind":"MuxTrace","bearer":"ConnectionId {localAddress = 172.31.9.105:45523, remoteAddress = 13.251.202.44:3001}"}
[c-c-1:cardano.node.Mux:Debug:74] [2020-01-17 13:55:42.20 UTC] {"event":"Channel Send End on MiniProtocolNum 2","kind":"MuxTrace","bearer":"ConnectionId {localAddress = 172.31.9.105:45523, remoteAddress = 13.251.202.44:3001}"}
[c-c-1:cardano.node.Mux:Debug:74] [2020-01-17 13:55:42.20 UTC] {"event":"Channel Send Start on MiniProtocolNum 2 2","kind":"MuxTrace","bearer":"ConnectionId {localAddress = 172.31.9.105:45523, remoteAddress = 13.251.202.44:3001}"}
[c-c-1:cardano.node.ChainDB:Debug:30] [2020-01-17 13:59:12.29 UTC] before next, messages elided = 3175
Suppressed 65286 messages from cardano-node.service
[c-c-1:cardano.node.ChainDB:Debug:30] [2020-01-17 13:59:12.29 UTC] {"event":{"kind":"TraceGCEvent.PerformedGC","slot":{"kind":"SlotNo","slot":719685}},"kind":"TraceEvent","tip":"e6a6260@722643"}
[c-c-1:cardano.node.ChainDB:Debug:30] [2020-01-17 13:59:12.29 UTC] {"event":{"kind":"TraceImmDBEvent"},"kind":"TraceEvent","tip":"e6a6260@722643"}
[c-c-1:cardano.node.ChainDB:Debug:30] [2020-01-17 14:04:12.29 UTC] {"event":{"kind":"TraceImmDBEvent"},"kind":"TraceEvent","tip":"e6a6260@722643"}
```
No related logs on the proxy.
A tcpdump (see attached) on proxy shows the following messages exchanged with c-c-1 (cardano-node):
```
[root@p-c-1:~]# tcpdump -ni eth0 host 3.0.154.58
tcpdump: verbose output suppressed, use -v or -vv for full protocol decode
listening on eth0, link-type EN10MB (Ethernet), capture size 262144 bytes
15:05:09.535032 IP 3.0.154.58.41567 > 172.31.3.75.3001: Flags [F.], seq 3358434695, ack 3946433162, win 211, options [nop,nop,TS val 2014159073 ecr 2054943025], length 0
15:05:09.578213 IP 172.31.3.75.3001 > 3.0.154.58.41567: Flags [.], ack 1, win 222, options [nop,nop,TS val 2056154527 ecr 2014159073], length 0
15:05:10.536806 IP 172.31.3.75.3001 > 3.0.154.58.41567: Flags [F.], seq 1, ack 1, win 222, options [nop,nop,TS val 2056155486 ecr 2014159073], length 0
15:05:10.537121 IP 3.0.154.58.41567 > 172.31.3.75.3001: Flags [.], ack 2, win 211, options [nop,nop,TS val 2014160075 ecr 2056155486], length 0
15:05:10.972241 IP 3.0.154.58.42577 > 172.31.3.75.3001: Flags [S], seq 2372599368, win 26883, options [mss 1460,sackOK,TS val 2014160510 ecr 0,nop,wscale 7], length 0
15:05:10.972282 IP 172.31.3.75.3001 > 3.0.154.58.42577: Flags [S.], seq 1973256822, ack 2372599369, win 26847, options [mss 8961,sackOK,TS val 2056155921 ecr 2014160510,nop,wscale 7], length 0
15:05:10.972509 IP 3.0.154.58.42577 > 172.31.3.75.3001: Flags [.], ack 1, win 211, options [nop,nop,TS val 2014160511 ecr 2056155921], length 0
15:05:10.972800 IP 3.0.154.58.42577 > 172.31.3.75.3001: Flags [P.], seq 1:18, ack 1, win 211, options [nop,nop,TS val 2014160511 ecr 2056155921], length 17
15:05:10.972814 IP 172.31.3.75.3001 > 3.0.154.58.42577: Flags [.], ack 18, win 210, options [nop,nop,TS val 2056155922 ecr 2014160511], length 0
15:05:11.015463 IP 172.31.3.75.3001 > 3.0.154.58.42577: Flags [P.], seq 1:17, ack 18, win 210, options [nop,nop,TS val 2056155964 ecr 2014160511], length 16
15:05:11.015699 IP 3.0.154.58.42577 > 172.31.3.75.3001: Flags [.], ack 17, win 211, options [nop,nop,TS val 2014160554 ecr 2056155964], length 0
15:05:11.016995 IP 3.0.154.58.42577 > 172.31.3.75.3001: Flags [P.], seq 18:750, ack 17, win 211, options [nop,nop,TS val 2014160555 ecr 2056155964], length 732
15:05:11.017025 IP 172.31.3.75.3001 > 3.0.154.58.42577: Flags [.], ack 750, win 222, options [nop,nop,TS val 2056155966 ecr 2014160555], length 0
15:05:11.021642 IP 172.31.3.75.3001 > 3.0.154.58.42577: Flags [P.], seq 17:30, ack 750, win 222, options [nop,nop,TS val 2056155971 ecr 2014160555], length 13
15:05:11.062129 IP 3.0.154.58.42577 > 172.31.3.75.3001: Flags [.], ack 30, win 211, options [nop,nop,TS val 2014160600 ecr 2056155971], length 0
15:05:11.062155 IP 172.31.3.75.3001 > 3.0.154.58.42577: Flags [P.], seq 30:126, ack 750, win 222, options [nop,nop,TS val 2056156011 ecr 2014160600], length 96
15:05:11.062360 IP 3.0.154.58.42577 > 172.31.3.75.3001: Flags [.], ack 126, win 211, options [nop,nop,TS val 2014160600 ecr 2056156011], length 0
15:05:11.068627 IP 3.0.154.58.42577 > 172.31.3.75.3001: Flags [P.], seq 750:760, ack 126, win 211, options [nop,nop,TS val 2014160607 ecr 2056156011], length 10
15:05:11.073792 IP 172.31.3.75.3001 > 3.0.154.58.42577: Flags [P.], seq 126:222, ack 760, win 222, options [nop,nop,TS val 2056156023 ecr 2014160607], length 96
15:05:11.079177 IP 3.0.154.58.42577 > 172.31.3.75.3001: Flags [P.], seq 760:770, ack 222, win 211, options [nop,nop,TS val 2014160617 ecr 2056156023], length 10
15:05:11.081459 IP 172.31.3.75.3001 > 3.0.154.58.42577: Flags [P.], seq 222:232, ack 770, win 222, options [nop,nop,TS val 2056156030 ecr 2014160617], length 10
15:05:11.121959 IP 3.0.154.58.42577 > 172.31.3.75.3001: Flags [.], ack 232, win 211, options [nop,nop,TS val 2014160660 ecr 2056156030], length 0
```
Comment from @karknu :

> It looks like the peer asks for an intersection, and the proxy finds an intersection. The peer ask for next block and is told to role back. The peer then requests the next block and is told to wait.
Being told to wait would happen if the proxy has no further blocks to send. Which is odd.

[p-c-1-c-c-1.pcap.zip](https://github.com/input-output-hk/cardano-byron-proxy/files/4091621/p-c-1-c-c-1.pcap.zip)

**Comment by oneEdoubleD** [comment]
I'll try recreate this and dig into it a little. What version of the Proxy is this? `1.0.2`, `1.0.3`, or `master`?

**Comment by jbgi** [comment]
@oneEdoubleD it appears the cluster was not correctly updated to obft era, which probably explains the issue. I'll report if it's not fixed.
